{"camera":{"device":"FaceTime HD Camera","firstFramePtsNs":1577241584,"frameIntervalNs":33350000,"height":720,"lastFramePtsNs":11282271584,"present":true,"width":1280},"capture":{"codec":"h264","firstFrameNs":292082334,"height":2160,"width":3326},"display":{"backingScale":2,"id":1,"originX":0,"originY":0,"pixelHeight":2338,"pixelWidth":3600,"pointHeight":1169,"pointWidth":1800},"files":{"camera":"camera.mp4","display":"display.mp4"},"stop":{"reason":"user","t":11446625542},"t0Ns":"218562620298416","timebase":{"denom":3,"numer":125},"version":2}