{
  "version": 2,
  "timebase": {
    "numer": 125,
    "denom": 3
  },
  "t0Ns": "1000000000",
  "display": {
    "id": 1,
    "pointWidth": 640,
    "pointHeight": 360,
    "pixelWidth": 640,
    "pixelHeight": 360,
    "backingScale": 1,
    "originX": 0,
    "originY": 0
  },
  "capture": {
    "width": 640,
    "height": 360,
    "codec": "h264",
    "firstFrameNs": 0
  },
  "camera": {
    "present": true,
    "device": "Fixture Camera",
    "width": 1280,
    "height": 720,
    "firstFramePtsNs": 1035500000,
    "lastFramePtsNs": 3024500000,
    "frameIntervalNs": 17000000
  },
  "files": {
    "display": "display.mp4",
    "camera": "camera.mp4"
  },
  "stop": {
    "t": 5000000016,
    "reason": "user"
  }
}
